{
  "id": "wsi_demo_1",
  "workspace_id": "ws_demo_molbio",
  "organization_id": "org_demo",
  "token": null,
  "role": "viewer",
  "created_by": "user_demo_admin",
  "expires_at": "2026-05-17T00:00:00Z",
  "revoked_at": null,
  "accepted_count": 0,
  "max_uses": 5,
  "created_at": "2026-05-10T00:00:00Z"
}
